name,position,school,city,state,zip,email,phone,image
K Gus Kousoulas,Principal Investigator,Louisiana State University School of Veterinary Medicine,Baton Rouge,Louisiana,70803,vtgusk@lsu.edu,(225) 578-5833,Kousoulas_Konstantin_LSU9425sm.jpg
Ramesh Subramanian,Program Coordinator,Louisiana State University School of Veterinary Medicine,Baton Rouge,Louisiana,70803,ramji@lsu.edu,(225) 578-9619,Admin_Ramesh_Subramanian.jpg
Alexis White,Grant Administrator,Louisiana State University Dept. of Biological Science,Baton Rouge,Louisiana,70803,alexisw@lsu.edu,(225) 578-9683,White_Alexis.jpg
John Quebedeaux Jr.,Computer Manager,Louisiana State University Dept. of Biological Science,Baton Rouge,Louisiana,70803,johnq@lsu.edu,(225) 578-0062,Admin_John_Q.png
Nayong Kim,Computer and Information Research Scientists,Louisiana State University Center for Computation & Technology,Baton Rouge,Louisiana,70803,nykim@cct.lsu.edu,(225) 578-5486,BBC-Core/BBC-Nayong-Kim.jpg
